{
  "$schema": "https://gist.githubusercontent.com/MarcScheib/eaed8888c0f47a4d52b7f938c70c2355/raw/8734e53ec76e085fcb559c3cdb394a5ea84e8ca0/use-case.schema.json",
  "id": "sync",
  "name": "Sync use-case",
  "description": "The sync use-case is called from the sync command",
  "state": "HIDDEN",
  "steps": []
}
