{
  "$schema": "https://raw.githubusercontent.com/CycriLabs/ws-ctrl/refs/heads/main/schemas/use-case.schema.json",
  "id": "init",
  "name": "Init use-case",
  "description": "The init use-case is called from the init command",
  "state": "INITIAL",
  "steps": [
    {
      "type": "PROMPT",
      "context": {
        "name": "clone",
        "message": "Do you want to clone repositories initially?",
        "type": "toggle"
      }
    },
    {
      "type": "USE_CASE",
      "description": "Do you want to clone repositories initially?",
      "skipIf": "clone === false",
      "useCase": "clone-repositories"
    }
  ]
}
