{
  "$schema": "https://raw.githubusercontent.com/CycriLabs/ws-ctrl/refs/heads/main/schemas/use-case.schema.json",
  "id": "check-requirements",
  "name": "Check requirements",
  "description": "This use case checks the requirements to develop locally.",
  "steps": [
    {
      "type": "FORMULA",
      "description": "Print OS info",
      "formula": "console.log(`Running on ${OS}`)"
    },
    {
      "type": "COMMAND",
      "description": "Execute commands",
      "context": {
        "commands": [
          "git --version",
          "node --version",
          "npm --version",
          "docker --version",
          "docker compose version"
        ]
      },
      "loop": {
        "list": "STEP.context.commands",
        "name": "command"
      },
      "command": "`${command}`"
    }
  ]
}
