{
  "$schema": "https://raw.githubusercontent.com/CycriLabs/ws-ctrl/refs/heads/main/schemas/use-case.schema.json",
  "id": "list-containers",
  "name": "List containers",
  "description": "List containers.",
  "steps": [
    {
      "type": "COMMAND",
      "description": "List all running docker containers",
      "command": "`docker compose ps`"
    }
  ]
}
