{
  "$schema": "https://raw.githubusercontent.com/CycriLabs/ws-ctrl/refs/heads/main/schemas/use-case.schema.json",
  "id": "clone-repositories",
  "name": "Clone repositories",
  "description": "This use case clones repositories.",
  "steps": [
    {
      "type": "PROMPT",
      "description": "Select the repositories to clones",
      "context": {
        "name": "repositories",
        "message": "Select the repositories",
        "type": "multiselect",
        "entityKey": "REPOSITORIES"
      }
    },
    {
      "type": "COMMAND",
      "description": "Clone repositories",
      "loop": {
        "list": "repositories",
        "name": "repository"
      },
      "command": "`git clone -b develop ${repository.url} ${WORKING_DIR}/${repository.alias}`"
    }
  ]
}
